Name,Studio,Genres
Log Horizon 2,Studio DEEN,"Adventure, Fantasy, Sci Fi, Economics, Guilds, Isekai, MMORPG, Overpowered Main Characters, Person in a Strange World, PVE, RPG, Trapped in a Video Game, Based on a Light Novel"
Transformers: The Movie,Toei Animation,"Action, Mecha, Sci Fi, Combining Mecha, Non-Human Protagonists, Super Robot, Transforming Mecha"
Spice and Wolf II OVA,Brain's Base,"Adventure, Drama, Fantasy, Romance, Animal Characteristics, Economics, God-Human Relationship, Gods, Interspecies Relationship, Mature Romance, Medieval, Non-Human Protagonists"
Code Geass: Lelouch of the Rebellion R2 Special Edition - Zero Requiem,Sunrise,"Mecha, Sci Fi, Real Robot, Recap"
Blue Exorcist,A-1 Pictures,"Action, Fantasy, Shounen, Contemporary Fantasy, Demons, Exorcists, Monster School, School Life, Siblings, Supernatural, Urban Fantasy, Based on a Manga"
Broken Blade Movie 3: Scars from an Assassin's Blade,Production I.G,"Action, Fantasy, Mecha, Magic, Military, War"
"Clannad: Another World, Tomoyo Chapter",Kyoto Animation,"Drama, Romance, School Life, Senpai-Kouhai Relationship, Based on a Visual Novel"
Seraph of the End: Battle in Nagoya,WIT Studio,"Action, Drama, Horror, Shounen, Demons, Pandemic, Post-apocalyptic, Supernatural, Vampires, Based on a Manga, Violence"
Monthly Girls' Nozaki-kun,Doga Kobo,"Comedy, Romance, Shounen, Gag, Manga Industry, Otaku Culture, Romantic Comedy, Satire, School Life, Writers, Based on a 4-Koma Manga, Based on a Manga"
Natsume's Book of Friends: Nyanko-sensei & The First Errand,Brain's Base,"Drama, Shoujo, Slice of Life, Bodyguards, Cats, Childcare, Countryside, Forest, Iyashikei, Japanese Mythology, Non-Human Protagonists, Supernatural, Youkai, Based on a Manga"
"Legend of the Galactic Heroes: A Hundred Billion Stars, A Hundred Billion Lights",Artland,"Drama, Sci Fi, Military, Outer Space, Space Opera, Based on a Novel, Violence"
From the New World,A-1 Pictures,"Adventure, Drama, Mystery, Sci Fi, Childhood Friends, Coming of Age, Dystopia, Post-apocalyptic, Psychic Powers, Superpowers, Thriller, Based on a Novel, Violence"
Wu Shen Zhuzai,Ruo Hong Culture,"Action, Fantasy, Chinese Animation, Short Episodes"
Cardcaptor Sakura: The Movie 2: The Sealed Card,MADHOUSE,"Fantasy, Magical Girl, Romance, Shoujo, Family Friendly, Henshin Heroes, Magic, Based on a Manga"
The Devil is a Part-Timer!,WHITE FOX,"Action, Comedy, Fantasy, Slice of Life, Contemporary Fantasy, Coworkers, Demon King, Demons, Lifestyle Change, Non-Human Protagonists, Person in a Strange World, Restaurants, Reverse Isekai, Urban Fantasy, Work Life, Based on a Light Novel"
Initial D Legend 2: Racer,LIDEN FILMS,"Drama, Seinen, Sports, Cars, Racing, Based on a Manga"
Interstella 5555 - The 5tory of the 5ecret 5tar 5ystem,Toei Animation,"Sci Fi, Aliens, Idols, Music, Non-Human Protagonists, Original Work"
Xingchen Bian,Foch,"Action, Fantasy, Chinese Animation, Cultivation, Xianxia, Based on a Web Novel, CG Animation"
Wan Jie Xian Zong 3rd Season,Ruo Hong Culture,"Action, Fantasy, Ancient China, Chinese Animation, Cultivation, Short Episodes, CG Animation"
Saiyuki Gaiden,Anpro,"Action, Fantasy, Journey to the West, Based on a Manga"
Junjou Romantica OVA,Studio DEEN,"BL, Comedy, Shounen-ai, Age Gap, LGBT Themes, Romantic Comedy, Based on a Manga, Sexual Content"
Tanaka-kun is Always Listless,SILVER LINK.,"Comedy, Slice of Life, Iyashikei, School Life, Based on a Manga"
Hyouka,Kyoto Animation,"Drama, Mystery, Shounen, School Club, School Life, Based on a Novel"
Naruto,Pierrot,"Action, Drama, Shounen, Japanese Mythology, Ninja, Revenge, Rivalries, Based on a Manga"
Kono Oto Tomare!,Platinum Vision,"Drama, Romance, Shounen, Music, School Club, School Life, Based on a Manga"
Mobile Suit Gundam: The Origin - Advent of the Red Comet,Sunrise,"Action, Drama, Mecha, Sci Fi, Outer Space, Real Robot"
Xingchen Bian 2nd Season,Foch,"Action, Fantasy, Chinese Animation, Xianxia, Based on a Web Novel, CG Animation"
Blue Spring Ride,Production I.G,"Drama, Romance, Shoujo, Love Triangle, School Life, Based on a Manga"
DAKAICHI: I'm being harassed by the sexiest man of the year- Spain Arc,CloverWorks,"BL, Romance, Yaoi, Acting, Adult Couples, Mature Romance, Showbiz, Based on a Manga"
Kokoro Connect: Michi Random,SILVER LINK.,"Drama, Romance, School Club, School Life, Supernatural, Based on a Light Novel"
Free! -Timeless Medley- The Promise,Animation Do,"Sports, Recap, School Club, School Life, Swimming, Tournaments, Based on a Light Novel"
Ling Jian Zun 5th Season,Soyep,"Action, Fantasy, Ancient China, Chinese Animation, Cultivation, Short Episodes, Based on a Web Novel, CG Animation"
Black Butler,A-1 Pictures,"Shounen, 19th Century, Butlers, Deal with the Devil, Demons, England, Europe, Master-Servant Relationship, Nobility, Non-Human Protagonists, Supernatural, Based on a Manga, Animal Abuse,, Mature Themes"
The Labyrinth of Grisaia,8-Bit,"Action, Drama, Childcare, Guns, Based on a Visual Novel, Emotional Abuse,, Mature Themes,, Nudity,, Physical Abuse,, Sexual Abuse,, Sexual Content"
Detective Conan Movie 16: The Eleventh Striker,TMS Entertainment,"Action, Mystery, Shounen, Sports, Age Transformation, Detectives, Soccer, Terrorism, Thriller, Based on a Manga"
Saint Seiya: The Hades Chapter - Sanctuary: Yomigaerishi Gold Saint-tachi no Shinwa,Toei Animation,"Sci Fi, Recap"
Ushio and Tora TV (2016),MAPPA,"Action, Fantasy, Shounen, Supernatural, Urban Fantasy, Based on a Manga"
My Teen Romantic Comedy SNAFU TOO! OVA,feel.,"Comedy, Romance, Seinen, Slice of Life, Based on a Light Novel"
Dragon Ball Super,Toei Animation,"Action, Comedy, Aliens, Gods, Hand to Hand Combat, Martial Arts, Non-Human Protagonists, Superpowers"
Nanbaka 2nd Season,SATELIGHT,"Action, Comedy, Island, Prison, Based on a Webtoon"
Big Windup! 2,A-1 Pictures,"Comedy, Drama, Seinen, Sports, Baseball, Codependency, Mental Illness, School Club, School Life, Tournaments, Based on a Manga"
Psycho-Pass: The Movie,Production I.G,"Action, Drama, Sci Fi, Dystopia, Guns, Thriller, Original Work, Explicit Violence"
Hi Score Girl: Extra Stage,J.C.Staff,"Comedy, Seinen, Historical, Video Game Industry, Based on a Manga, CG Animation"
Shirobako,P.A. WORKS,"Comedy, Drama, Slice of Life, Anime Industry, Coworkers, Otaku Culture, Voice Acting, Work Life, Original Work"
How to Keep a Mummy,8-Bit,"Comedy, Fantasy, Slice of Life, Contemporary Fantasy, Japanese Mythology, Pets, Youkai, Based on a Webtoon"
Kakuriyo: Bed & Breakfast for Spirits,GONZO,"Fantasy, Romance, Shoujo, Animal Characteristics, Contemporary Fantasy, Debt, Demons, Food and Beverage, Hotels and Inns, Interspecies Relationship, Isekai, Japanese Mythology, Lifestyle Change, Non-Human Protagonists, Person in a Strange World, Restaurants, Supernatural, Youkai, Based on a Light Novel"
Sword Art Online: Alicization - War of Underworld: Part II,A-1 Pictures,"Action, Fantasy, Sci Fi, Magic, Medieval, MMORPG, Overpowered Main Characters, Person in a Strange World, RPG, Virtual Reality, War, Based on a Light Novel, Mature Themes,, Physical Abuse,, Violence,, Self-Harm"
Durarara!! Specials,Brain's Base,"Action, Gangs, Supernatural, Yakuza, Based on a Light Novel"
Stand By Me Doraemon 2,Robot,"Comedy, Drama, Sci Fi, Shounen, Cats, Family Friendly, Non-Human Protagonists, Robots, CG Animation"
Poco's Udon World,LIDEN FILMS,"Seinen, Slice of Life, Animal Characteristics, Animal Transformation, Countryside, Death of a Loved One, Family Life, Iyashikei, Japanese Mythology, Lifestyle Change, Non-Human Protagonists, Orphans, Supernatural, Youkai, Based on a Manga"
Initial D Legend 1: Awakening,LIDEN FILMS,"Drama, Seinen, Sports, Cars, Racing, Based on a Manga"
Perfect Blue,MADHOUSE,"Horror, Acting, Idols, Noir, Psychological, Showbiz, Stalkers, Thriller, Based on a Novel, Explicit Sex,, Mature Themes,, Physical Abuse,, Sexual Abuse,, Violence"
Neon Genesis Evangelion: The End of Evangelion,GAINAX,"Mecha, Military, Post-apocalyptic, Psychological, Super Robot, Original Work, Explicit Violence,, Nudity,, Sexual Content"
The Eden of Grisaia,8-Bit,"Action, Drama, Sci Fi, Guns, Military, Based on a Visual Novel, Nudity,, Sexual Content,, Violence"
Working'!!,A-1 Pictures,"Comedy, Romance, Seinen, Slice of Life, Androphobia, Coworkers, Restaurants, Work Life, Based on a 4-Koma Manga, Based on a Manga"
Girls und Panzer: Saishuushou 2,Actas,"Action, Military, Military School, School Club, School Life, Tournaments, Original Work"
Naruto Shippuden Movie 6: Road to Ninja,Pierrot,"Action, Fantasy, Shounen, Ninja, Person in a Strange World, Based on a Manga"
Lupin III vs Detective Conan: The Movie,Double Eagle,"Action, Comedy, Criminals, Crossover, Detectives, Thieves"
Jormungand,WHITE FOX,"Action, Seinen, Gangs, Guns, Mercenaries, Military, Based on a Manga, Nudity,, Violence"
Free! -Timeless Medley- The Bond,Animation Do,"Sports, Recap, School Club, School Life, Swimming, Tournaments, Based on a Light Novel"
My Next Life as a Villainess: All Routes Lead to Doom!,SILVER LINK.,"Comedy, Fantasy, Josei, Reverse Harem, Romance, Isekai, Magic, Nobility, Person in a Strange World, Reincarnation, Villainess, Based on a Light Novel"
High School DxD NEW,TNK,"Action, Ecchi, Fantasy, Harem, Shounen, Contemporary Fantasy, Demons, Newly Co-ed School, School Life, Based on a Light Novel, Sexual Content"
Detective Conan Movie 2: The Fourteenth Target,TMS Entertainment,"Mystery, Shounen, Age Transformation, Detectives, Based on a Manga"
Hozuki's Coolheadedness OVA 2,Studio DEEN,"Comedy, Seinen, Afterlife, Dark Comedy, Demons, Dogs, Gag, Hell, Japanese Mythology, Non-Human Protagonists, Parody, Satire, Supernatural, Youkai, Based on a Manga"
Eden of the East,Production I.G,"Mystery, Amnesia, Conspiracy, High Stakes Games, NEET, noitaminA, Original Work"
Attack on Titan: Lost Girls,WIT Studio,"Drama, Fantasy, Mystery, Dark Fantasy, Isolated Society, Military, Outside World, Post-apocalyptic, Based on a Light Novel, Explicit Violence"
Mobile Suit Gundam: The 08th MS Team,Sunrise,"Action, Drama, Mecha, Sci Fi, Forest, Jungle, Military, Real Robot, War, Nudity,, Violence"
Mobile Suit Gundam Wing: Endless Waltz Movie,Sunrise,"Mecha, Sci Fi, Outer Space"
My Teen Romantic Comedy SNAFU,Brain's Base,"Comedy, Drama, Romance, Seinen, Coming of Age, School Club, School Life, Based on a Light Novel"
Wolf's Rain OVA,Bones,"Adventure, Drama, Fantasy, Mystery, Animal Protagonists, Dystopia, Non-Human Protagonists, Post-apocalyptic, Original Work, Violence"
Berserk: Golden Age Arc I - The Egg of the King,Studio 4°C,"Action, Fantasy, Seinen, Dark Fantasy, Demons, Medieval, Mercenaries, Overpowered Main Characters, Swordplay, Based on a Manga, Explicit Violence,, Nudity"
The Quintessential Quintuplets,Tezuka Productions,"Comedy, Drama, Harem, Romance, Shounen, School Life, Siblings, Tutors, Based on a Manga"
Sket Dance OVA,Tatsunoko Production,"Comedy, Shounen, Slice of Life, Gag, School Club, School Life, Based on a Manga"
Kaiji - Ultimate Survivor,MADHOUSE,"Seinen, Debt, Gambling, High Stakes Games, Mind Games, Psychological, Thriller, Based on a Manga, Mature Themes,, Physical Abuse"
Spiritpact: Bond of The Underworld,Haoliners Animation League,"Action, BL, Shounen-ai, Chinese Animation, Exorcists, Ghosts, Master-Servant Relationship, Supernatural, Based on a Manga"
Neon Genesis Evangelion,GAINAX,"Drama, Mecha, Sci Fi, Conspiracy, Kaijuu, Loneliness, Melancholy, Military, Monsters, Post-apocalyptic, Psychological, Super Robot, Original Work, Emotional Abuse,, Explicit Violence,, Mature Themes,, Suicide"
"The Night is Short, Walk On Girl",Science SARU,"Comedy, Romance, Abstract, Adult Couples, Love Confession, Romantic Comedy, Based on a Novel"
Orange,Telecom Animation Film,"Drama, Mystery, Romance, Shoujo, Death of a Loved One, Melancholy, Mental Illness, Psychological, School Life, Supernatural, Unrequited Love, Based on a Manga, Mature Themes,, Suicide"
Tian Bao Fuyao Lu,Sparkly Key Animation Studio,"BL, Fantasy, Romance, Shounen-ai, Chinese Animation, Based on a Web Novel, CG Animation"
Aggretsuko,Fanworks,"Comedy, Animal Protagonists, Anthropomorphic, Coworkers, Music, Non-Human Protagonists, Sanrio Characters, Work Life, Original Work"
Fanren Xiu Xian Chuan,Original Force,"Fantasy, Chinese Animation, CG Animation"
Xue Ying Lingzhu Zhi Qiyu Pian,Mili Pictures,"Action, Fantasy, Ancient China, Chinese Animation, Based on a Web Novel, CG Animation"
Detective Conan Movie 21: Kara Kurenai no Love Letter,TMS Entertainment,"Drama, Mystery, Shounen, Age Transformation, Detectives, Based on a Manga"
Kuroko's Basketball Movie 1: Winter Cup Highlights -Shadow and Light-,Production I.G,"Shounen, Sports, Basketball, Recap, School Club, Tournaments, Based on a Manga"
YOASOBI: Kaibutsu,Orange,CG Animation
Detective Conan Movie 1: The Time Bombed Skyscraper,TMS Entertainment,"Action, Mystery, Shounen, Age Transformation, Detectives, Thriller, Based on a Manga, Violence"
The Morose Mononokean II,St. Signpost,"Comedy, Fantasy, Shounen, Contemporary Fantasy, Exorcists, Iyashikei, Japanese Mythology, School Life, Supernatural, Youkai, Based on a Manga"
The Garden of Sinners Movie 2: ...And Nothing Heart. (Murder Speculation Part A),ufotable,"Drama, Horror, Mystery, Romance, Overpowered Main Characters, Split Personality, Supernatural, Based on a Light Novel, Violence"
Broken Blade Movie 6: Fortress of Lamentation,Production I.G,"Action, Fantasy, Mecha, Magic, Military, War, Violence"
Hakuouki Movie 1: Wild Dance of Kyoto,Studio DEEN,"Action, Drama, Reverse Harem, Feudal Japan, Historical, Samurai, Based on an Otome Game, Based on a Visual Novel"
Beastars,Orange,"Drama, Fantasy, Romance, Shounen, Animal Protagonists, Anthropomorphic, Non-Human Protagonists, Psychological, School Life, Based on a Manga, CG Animation, Bullying,, Emotional Abuse,, Mature Themes,, Sexual Content,, Violence"
Ride Your Wave,Science SARU,"Drama, Romance, Slice of Life, Adult Couples, Death of a Loved One, Firefighters, Mature Romance, Original Work"
Goblin Slayer,WHITE FOX,"Action, Adventure, Fantasy, Seinen, Dark Fantasy, Guilds, Magic, Medieval, Monsters, Based on a Light Novel, Explicit Sex,, Explicit Violence,, Mature Themes,, Physical Abuse,, Sexual Abuse"
Death Billiards,MADHOUSE,"Drama, Afterlife, Anime Tamago, Bar, Billiards, High Stakes Games, Play or Die, Psychological, PVP, Shorts, Supernatural, Thriller, Original Work"
D.Gray-man,TMS Entertainment,"Action, Adventure, Shounen, Afterlife, Demons, Europe, Exorcists, Supernatural, Superpowers, Based on a Manga, Animal Abuse,, Mature Themes,, Violence"
Broken Blade Movie 2: The Path of Separation,Production I.G,"Action, Fantasy, Mecha, Magic, Military, War"
Silver Fang,Toei Animation,"Action, Adventure, Shounen, Animal Protagonists, Bears, Dogs, Non-Human Protagonists, Revenge, Based on a Manga, Animal Abuse,, Explicit Violence,, Mature Themes"
Kase-san & Morning Glories,Zexcs,"GL, Romance, Shoujo-ai, Opposites Attract, School Life, Based on a Manga"
Ascendance of a Bookworm OVA,Ajia-do,"Fantasy, Cheats, Isekai, Magic, Medieval, Modern Knowledge, Person in a Strange World, Reincarnation, Short Episodes, Based on a Light Novel"
Pokemon: The Origin,OLM,"Action, Adventure, Fantasy, Shounen, Elemental Powers, Monsters, Proxy Battles, Based on a Video Game"
The Eccentric Family 2,P.A. WORKS,"Comedy, Drama, Fantasy, Slice of Life, Animal Transformation, Contemporary Fantasy, Family Life, Japanese Mythology, Non-Human Protagonists, Urban Fantasy, Youkai, Based on a Novel"
The Anthem of the Heart,A-1 Pictures,"Drama, Coming of Age, Mental Illness, School Life, Supernatural, Original Work"
Free! Dive to the Future: Build-Up of Early Spring!,Animation Do,"Slice of Life, Sports, Swimming, Based on a Light Novel"
Magic Kaito,TMS Entertainment,"Action, Comedy, Drama, Shounen, Secret Identity, Thieves, Based on a Manga"
Detective Conan Movie 12: Full Score of Fear,TMS Entertainment,"Drama, Mystery, Shounen, Age Transformation, Classical Music, Detectives, Music, Music School, School Life, Based on a Manga"
Free! Eternal Summer,Animation Do,"Comedy, Drama, Sports, Childhood Friends, Rivalries, School Club, School Life, Swimming, Based on a Light Novel"
Tamako Love Story,Kyoto Animation,"Romance, Slice of Life, Love Confession, Original Work"
Rurouni Kenshin: Special Techniques,Gallop,"Action, Shounen, Feudal Japan, Samurai, Swordplay, Based on a Manga"
Seitokai Yakuindomo* OVA,GoHands,"Comedy, Shounen, Crude, Newly Co-ed School, Parody, Satire, School Life, Student Council, Based on a 4-Koma Manga, Based on a Manga, Sexual Content"
The Melancholy of Haruhi Suzumiya,Kyoto Animation,"Comedy, Shounen, Breaking the Fourth Wall, School Club, School Life, Based on a Light Novel"
Miss Kobayashi's Dragon Maid: Valentines and Hot Springs! (Please Don't Get Your Hopes Up),Kyoto Animation,"Comedy, Fantasy, Seinen, Slice of Life, Animal Characteristics, Contemporary Fantasy, Dragons, Maids, Monster Girls, Non-Human Protagonists, Urban Fantasy, Based on a Manga"
Noragami OVA,Bones,"Comedy, Shounen, Ghosts, Gods, Japanese Mythology, Non-Human Protagonists, Supernatural, Based on a Manga"
Phantom: Requiem for the Phantom,BEE TRAIN,"Action, Amnesia, Assassins, Criminals, Gangs, Guns, Psychological, Based on a Visual Novel, Nudity,, Violence"
Durarara!! X2: My Heart Is in the Pattern of a Hot Pot,Shuka,"Slice of Life, Food and Beverage, Supernatural, Based on a Light Novel"
The Misfit of Demon King Academy,SILVER LINK.,"Action, Comedy, Fantasy, Demon King, Demons, Magic, Magic School, Non-Human Protagonists, Overpowered Main Characters, Reincarnation, School Life, Based on a Light Novel, Violence"
Free! Dive to the Future,Animation Do,"Sports, Codependency, School Club, Swimming, Based on a Light Novel"
Zombie Land Saga Revenge,MAPPA,"Idols, Music, Supernatural, Zombies, Original Work"
Mob Psycho 100 II: The First Spirits and Such Company Trip - A Journey that Mends the Heart and Heals the Soul,Bones,"Action, Comedy, Shounen, Psychic Powers, Psychological, School Life, Supernatural, Superpowers, Based on a Manga"
Real Girl 2nd Season,Hoods Entertainment,"Comedy, Romance, Shoujo, School Life, Based on a Manga"
Kuroko's Basketball: Let's Do That Again,Production I.G,"Shounen, Sports, Basketball, Based on a Manga"
The World is Still Beautiful,Pierrot,"Fantasy, Romance, Shoujo, Age Gap, Arranged Marriage, Lifestyle Change, Royalty, Based on a Manga"
High School DxD BorN,TNK,"Action, Ecchi, Fantasy, Harem, Shounen, Angels, Contemporary Fantasy, Demons, Newly Co-ed School, Non-Human Protagonists, Norse Mythology, School Life, Based on a Light Novel, Nudity,, Sexual Content"
xxxHOLiC Movie: A Midsummer Night's Dream,Production I.G,"Seinen, Japanese Mythology, Supernatural, Based on a Manga"
Is It Wrong to Try to Pick Up Girls in a Dungeon? III,J.C.Staff,"Action, Fantasy, Harem, Dungeon, Guilds, Monsters, RPG, Swordplay, Based on a Light Novel, Mature Themes,, Violence,, Self-Harm"
Girls' Last Tour,WHITE FOX,"Adventure, Drama, Sci Fi, Seinen, Slice of Life, Iyashikei, Melancholy, Orphans, Post-apocalyptic, Based on a Manga"
Date a Live: Encore OVA,Production IMS,"Harem, Romance, Sci Fi, Based on a Light Novel"
Blood Blockade Battlefront & Beyond,Bones,"Action, Sci Fi, Shounen, Episodic, Supernatural, Superpowers, Vampires, Based on a Manga, Violence"
Lucky Star OVA,Kyoto Animation,"Comedy, Shounen, Slice of Life, Gag, Otaku Culture, Based on a 4-Koma Manga, Based on a Manga"
When They Cry: Higurashi,Studio DEEN,"Horror, Mystery, Countryside, Curse, Psychological, School Life, Thriller, Based on a Visual Novel, Emotional Abuse,, Explicit Violence,, Mature Themes,, Physical Abuse,, Domestic Abuse"
Baby Steps,Pierrot,"Shounen, Sports, School Life, Tennis, Tournaments, Based on a Manga"
Final Fantasy VII: Advent Children,Visual Works,"Action, Fantasy, Martial Arts, Swordplay, Based on a Video Game, CG Animation"
Psycho-Pass SS: Case. 3 - Onshuu no Kanata ni,Production I.G,"Sci Fi, Cyberpunk, Dystopia, Noir, Police, Original Work, Explicit Violence,, Nudity"
The Cat Returns,Studio Ghibli,"Fantasy, Animal Protagonists, Animal Transformation, Anthropomorphic, Cats, Contemporary Fantasy, Family Friendly, Non-Human Protagonists, Based on a Manga"
Yumeiro Pâtissière,Studio Hibari,"Fantasy, Shoujo, Baking, Culinary School, Family Friendly, Food and Beverage, School Life, Based on a Manga"
D.Gray-man Hallow,8 Pan,"Action, Adventure, Shounen, Afterlife, Demons, Exorcists, Supernatural, Superpowers, Based on a Manga"
Sword Art Online Movie: Ordinal Scale,A-1 Pictures,"Action, MMORPG, Overpowered Main Characters, Person in a Strange World, PVE, Virtual Reality, Based on a Light Novel, Nudity"
Wushang Shen Di 2nd Season,Ruo Hong Culture,"Action, Fantasy, Ancient China, Chinese Animation, Short Episodes, Based on a Web Novel, CG Animation"
Hungry Days x One Piece,SHAFT,"Commercials, Food and Beverage, Parody, Promotional, School Life, Short Episodes"
Paprika,MADHOUSE,"Sci Fi, Dream World, Hacking, Psychological, Based on a Novel, Nudity"
Revue Starlight Movie,Kinema Citrus,"Drama, Abstract, All-Girls School, Childhood Friends, Showbiz, Original Work, Violence"
Magical Girl Lyrical Nanoha A's,Seven Arcs,"Fantasy, Magical Girl, Seinen, Contemporary Fantasy, Disability, Henshin Heroes, Magic, Urban Fantasy, Original Work"
Liz and the Blue Bird,Kyoto Animation,"Music, School Club, School Life, Based on a Novel"
Thunderbolt Fantasy 3,Pili International Multimedia,"Action, Fantasy, Ancient China, Swordplay, Wuxia, Original Work"
Attack on Titan: Ilse's Notebook,WIT Studio,"Action, Fantasy, Horror, Shounen, Dark Fantasy, Isolated Society, Outside World, Post-apocalyptic, Based on a Manga, Cannibalism,, Violence"
Hakuouki: Dawn of the Shinsengumi Tokuten Disc,Studio DEEN,"Action, Drama, Reverse Harem, Feudal Japan, Historical, Samurai, Short Episodes, Based on an Otome Game, Based on a Visual Novel"
The Garden of Words,CoMix Wave Films,"Drama, Romance, Age Gap, Loneliness, Melancholy, Original Work"
Tsurune,Kyoto Animation,"Sports, Archery, School Club, School Life, Tournaments, Based on a Light Novel"
Lupin III: Part IV,Telecom Animation Film,"Action, Comedy, Criminals, Europe, Italy, Thieves"
Saint Seiya: The Lost Canvas - Meiou Shinwa,TMS Entertainment,"Action, Fantasy, Sci Fi, Shounen, 18th Century, Europe, Gods, Greek Mythology, Hand to Hand Combat, Historical, Non-Human Protagonists, Power Suits, Superpowers, Based on a Manga, Violence"
Anohana: The Flower We Saw That Day Movie,A-1 Pictures,"Drama, Romance, Childhood Friends, Coming of Age, Death of a Loved One, Ghosts, Recap, Supernatural, Original Work"
Outlaw Star,Sunrise,"Action, Adventure, Comedy, Sci Fi, Seinen, Mercenaries, Outer Space, Based on a Manga, Nudity"
Little Witch Academia TV,TRIGGER,"Adventure, Fantasy, Magic, Magic School, School Life, Witches, Original Work"
Magical Girl Lyrical Nanoha The MOVIE 1st,Seven Arcs,"Action, Fantasy, Magical Girl, Contemporary Fantasy, Henshin Heroes, Magic, Recap, Urban Fantasy, Original Work, Mature Themes,, Nudity,, Domestic Abuse"
Glass Mask (2005),TMS Entertainment,"Drama, Romance, Shoujo, Acting, Showbiz, Work Life, Based on a Manga"
"Hora, Mimi ga Mieteru yo! 2",monofilmo,"BL, Comedy, Fantasy, Romance, Shounen-ai, Slice of Life, Age Gap, Animal Characteristics, Animal Transformation, Cats, Contemporary Fantasy, Interspecies Relationship, Manga Industry, Non-Human Protagonists, Orphans, Roommates, Short Episodes, Writers, Based on a Webtoon"
Detective Conan Movie 17: Zekkai no Private Eye,TMS Entertainment,"Action, Mystery, Shounen, Age Transformation, Detectives, Thriller, Based on a Manga"
Sword Art Online: Alicization,A-1 Pictures,"Action, Fantasy, Sci Fi, Medieval, Overpowered Main Characters, Person in a Strange World, RPG, Virtual Reality, Based on a Light Novel, Explicit Violence,, Mature Themes,, Physical Abuse,, Sexual Abuse"
The Irregular at Magic High School: Reminiscence Arc,8-Bit,"Action, Drama, Sci Fi, Shounen, Magic, Siblings, Supernatural, Based on a Light Novel"
Kill La Kill,TRIGGER,"Action, Comedy, Ecchi, Sci Fi, Aliens, Animeism, Conspiracy, Rebellions, School Life, Superpowers, Swordplay, Original Work, Mature Themes,, Physical Abuse,, Sexual Abuse,, Violence,, Domestic Abuse"
Girls und Panzer das Finale: Part 1,Actas,"Action, Military, Military School, School Club, School Life, Tournaments, Original Work"
Akame ga Kill!,WHITE FOX,"Action, Fantasy, Shounen, Assassins, Dark Fantasy, Lifestyle Change, Rebellions, Urban Fantasy, Vigilantes, Based on a Manga, Explicit Violence"
Yuru Yuri San☆Hai!,TYO Animations,"Comedy, GL, Seinen, Shoujo-ai, Slice of Life, School Club, School Life, Based on a Manga"
Alderamin on the Sky,MADHOUSE,"Action, Fantasy, Seinen, Guns, Military, War, Based on a Light Novel"
Aria the Natural,Hal Film Maker,"Sci Fi, Shounen, Slice of Life, Apprenticeship, Iyashikei, Ocean, Work Life, Based on a Manga"
Detective Conan Movie 7: Crossroad in the Ancient Capital,TMS Entertainment,"Mystery, Shounen, Age Transformation, Detectives, Thieves, Based on a Manga"
Ghost Hunt,J.C.Staff,"Horror, Shoujo, Curse, Detectives, Ghost Hunters, Supernatural, Based on a Light Novel"
The Daily Life of the Immortal King 2,Haoliners Animation League,"Comedy, Fantasy, Chinese Animation, Cultivation, Overpowered Main Characters, School Life, Urban Fantasy, Based on a Web Novel"
Food Wars! The Fifth Plate,J.C.Staff,"Comedy, Ecchi, Shounen, Cooking, Culinary School, Food and Beverage, Based on a Manga"
Love Live! The School Idol Movie,Sunrise,"Idols, Music"
Hi Score Girl II,J.C.Staff,"Comedy, Seinen, Historical, Video Game Industry, Based on a Manga, CG Animation"
Code Geass: Lelouch of the Rebellion Special Edition - Black Rebellion,Sunrise,"Mecha, Sci Fi, Real Robot, Recap"
Baka and Test - Summon the Beasts 2,SILVER LINK.,"Comedy, Chibi, Magic, Magic School, School Life, Based on a Light Novel"
