Name,Studio,Genres
Lie Huo Jiao Chou,Shenying Animation,"Action, BL, Drama, Shounen-ai, Chinese Animation, Reincarnation, Supernatural, Based on a Novel, CG Animation"
Non Non Biyori Repeat OVA,SILVER LINK.,"Comedy, Seinen, Slice of Life, Countryside, Iyashikei, Based on a Manga"
Hakkenden: Eight Dogs of the East 2,Studio DEEN,"Action, Fantasy, Shoujo, Supernatural, Based on a Manga"
Xie Wang Zhui Qi Zhi Yishi Qingcheng,BigFireBird,"Action, Comedy, Drama, Fantasy, Romance, Ancient China, Chinese Animation, Cultivation, Isekai, Martial Arts, Xianxia, Based on a Web Novel"
Macross Frontier Movie 2: Sayonara no Tsubasa,SATELIGHT,"Action, Drama, Mecha, Romance, Sci Fi, Idols, Love Triangle, Music, Real Robot, Transforming Mecha"
Wan Jie Xian Zong 5th Season,Ruo Hong Culture,"Action, Fantasy, Ancient China, Chinese Animation, Cultivation, Short Episodes, Based on a Manga, CG Animation"
Kokoro Connect,SILVER LINK.,"Drama, Romance, Androphobia, Body Swapping, Love Triangle, School Club, School Life, Supernatural, Based on a Light Novel"
The World God Only Knows,Manglobe,"Comedy, Fantasy, Romance, Shounen, Demons, Otaku Culture, School Life, Based on a Manga"
Eden of The East Movie II: Paradise Lost,Production I.G,"Mystery, Conspiracy, High Stakes Games, Original Work"
Mr. Osomatsu 2nd Season,Pierrot,"Comedy, Slice of Life, Breaking the Fourth Wall, Episodic, Gag, NEET, Parody, Siblings, Slapstick, Based on a Manga"
Sket Dance,Tatsunoko Production,"Comedy, Shounen, Slice of Life, Breaking the Fourth Wall, Episodic, Gag, School Club, School Life, Based on a Manga"
Blue Exorcist: Kyoto Saga,A-1 Pictures,"Action, Drama, Fantasy, Shounen, Animeism, Contemporary Fantasy, Demons, Exorcists, Supernatural, Urban Fantasy, Based on a Manga"
Wan Jie Fa Shen,Ruo Hong Culture,"Action, Fantasy, Chinese Animation, Magic, Magic School, Martial Arts, School Life, Short Episodes, CG Animation"
My Hero Academia - All Might: Rising The Animation,Bones,"Action, Sci Fi, Shounen, Superheroes, Superpowers, Based on a Manga"
Zoku Sayonara Zetsubou Sensei,SHAFT,"Comedy, Shounen, Slice of Life, Breaking the Fourth Wall, Dark Comedy, Gag, Parody, Satire, School Life, Teaching, Based on a Manga, Mature Themes,, Suicide"
Fate/Grand Order: Absolute Demonic Front - Babylonia,CloverWorks,"Action, Fantasy, Sci Fi, Gods, Greek Mythology, Magic, Person in a Strange World, Proxy Battles, Superpowers, Based on a Mobile Game, Violence"
Liang Bu Yi: Part II,Paper Plane,"Comedy, Romance, Ancient China, Body Swapping, Chibi, Chinese Animation, Gender Bender, Political, Royalty, War, Based on a Webtoon, CG Animation"
Eden of The East Movie I: The King of Eden,Production I.G,"Mystery, America, Amnesia, Conspiracy, High Stakes Games, Original Work"
Is It Wrong to Try to Pick Up Girls in a Dungeon? II,J.C.Staff,"Action, Comedy, Fantasy, Harem, Romance, Dungeon, Guilds, RPG, Swordplay, Weak to Strong, Based on a Light Novel, Violence"
The Rose of Versailles,TMS Entertainment,"Drama, Romance, Shoujo, 18th Century, Europe, France, French Revolution, Historical, Political, Social Gap, Based on a Manga"
My Bride Is a Mermaid OVA,AIC,"Comedy, Shounen, Mermaids, Based on a Manga"
Tiger & Bunny,Sunrise,"Action, Comedy, Sci Fi, Death of a Loved One, Superheroes, Superpowers, Original Work, Mature Themes,, Physical Abuse,, Domestic Abuse"
Capeta,Studio Comet,"Action, Shounen, Sports, Cars, Racing, Based on a Manga"
Kaguya-sama: Love is War - Ultra Romantic PV - Yu Ishigami Wants to Discuss It,A-1 Pictures,"Comedy, Drama, Romance, Mind Games, Otaku Culture, Promotional, Romantic Comedy, School Life, Student Council, Based on a Manga"
IDOLiSH7,TROYCA,"Drama, Idols, Music, Showbiz, Based on a Mobile Game"
Little Witch Academia: The Enchanted Parade,TRIGGER,"Fantasy, Magic, Magic School, School Life, Witches, Original Work"
Yotsuiro Biyori,Zexcs,"Slice of Life, Cafe, Coworkers, Food and Beverage, Iyashikei, Work Life, Based on a Manga"
Hayate the Combat Butler!!,J.C.Staff,"Comedy, Shounen, Butlers, Maids, Master-Servant Relationship, Parody, Tsundere, Based on a Manga"
Wu Geng Ji 3rd Season,Sparkly Key Animation Studio,"Action, Fantasy, Ancient China, Chinese Animation, Based on a Manga, CG Animation"
The Heroic Legend of Arslan,LIDEN FILMS,"Action, Adventure, Fantasy, Shounen, Medieval, Middle Eastern, Military, Political, Rebellions, Royalty, Swordplay, War, Based on a Manga, Animal Abuse,, Mature Themes,, Suicide,, Violence"
Mobile Suit Gundam Wing,Sunrise,"Action, Mecha, Sci Fi, Outer Space, Political, Terrorism, War, Original Work"
The Seven Deadly Sins Movie: Prisoners of the Sky,A-1 Pictures,"Action, Adventure, Fantasy, Shounen, Angels, Demons, Island, Magic, Medieval, Non-Human Protagonists, Overpowered Main Characters, Based on a Manga, Violence"
Hell Girl: Two Mirrors,Studio DEEN,"Horror, Deal with the Devil, Episodic, Melancholy, Supernatural, Youkai, Original Work, Bullying,, Emotional Abuse"
Super Dimensional Fortress Macross,Tatsunoko Production,"Drama, Mecha, Romance, Sci Fi, Aliens, Idols, Love Triangle, Military, Music, Outer Space, Real Robot, Space Opera, Transforming Mecha, War, Original Work"
Seitokai Yakuindomo Movie 2,GoHands,"Comedy, Shounen, Crude, Gag, Newly Co-ed School, Parody, Satire, School Life, Student Council, Based on a 4-Koma Manga, Based on a Manga"
Meiji Tokyo Renka Movie: Yumihari no Serenade,Studio DEEN,"Fantasy, Reverse Harem, Romance, Time Travel, Based on an Otome Game, Based on a Visual Novel"
My Little Monster,Brain's Base,"Comedy, Romance, Shoujo, Slice of Life, Opposites Attract, Romantic Comedy, School Life, Based on a Manga"
Shiki Specials,Daume,"Horror, Countryside, Psychological, Supernatural, Vampires, Based on a Light Novel, Explicit Violence"
Orange -Mirai-,Telecom Animation Film,"Drama, Mystery, Romance, Shoujo, School Life, Supernatural, Based on a Manga"
Mobile Suit Gundam: Thunderbolt - December Sky,Sunrise,"Action, Mecha, Sci Fi, Seinen, Military, Psychological, Real Robot, War, Based on a Manga, Drug Use,, Mature Themes,, Violence"
Mr. Osomatsu,Pierrot,"Comedy, Josei, Slice of Life, Breaking the Fourth Wall, Episodic, Family Life, Gag, NEET, Parody, Siblings, Slapstick, Based on a Manga"
Yuru Yuri ♪♪,Doga Kobo,"Comedy, GL, Seinen, Shoujo-ai, Slice of Life, School Club, School Life, Based on a Manga"
Wan Jie Xian Zong,Ruo Hong Culture,"Action, Fantasy, Ancient China, Chinese Animation, Cultivation, Short Episodes, Based on a Manga, CG Animation"
Symphogear XV,SATELIGHT,"Action, Sci Fi, Music, Superpowers, Original Work, Violence"
Cardcaptor Sakura: Clear Card-hen,MADHOUSE,"Fantasy, Magical Girl, Shoujo, Contemporary Fantasy, Henshin Heroes, Magic, Urban Fantasy, Based on a Manga"
Zan Sayonara Zetsubou Sensei,SHAFT,"Comedy, Shounen, Breaking the Fourth Wall, Dark Comedy, Gag, Teaching, Based on a Manga"
The Familiar of Zero: Knight of the Twin Moons,J.C.Staff,"Comedy, Fantasy, Isekai, Magic, Magic School, Master-Servant Relationship, Person in a Strange World, School Life, Tsundere, Based on a Light Novel"
Angel Beats! Stairway to Heaven,P.A. WORKS,"Comedy, Afterlife, School Life, Supernatural, Original Work"
Toshokan Sensou: Kakumei no Tsubasa,Production I.G,"Action, Comedy, Drama, Library, Military, Political, Based on a Light Novel"
Rakshasa Street 2nd Season,L2 Studio,"Action, Chinese Animation, Supernatural, Based on a Manga"
Hidamari Sketch x Honeycomb,SHAFT,"Comedy, Seinen, Slice of Life, Art, Art School, Boarding House, Iyashikei, Neighbors, School Life, Based on a 4-Koma Manga, Based on a Manga"
Xue Ying Lingzhu 2nd Season,Mili Pictures,"Action, Fantasy, Ancient China, Chinese Animation, Based on a Web Novel, CG Animation"
Quanzhi Fashi III,Foch,"Action, Fantasy, Chinese Animation, Elemental Powers, Magic, School Life, Supernatural, Urban Fantasy, Based on a Web Novel"
The Irregular at Magic High School,MADHOUSE,"Action, Sci Fi, Brother Complex, Magic, Magic School, Overpowered Main Characters, School Life, Siblings, Based on a Light Novel, Violence"
Den-noh Coil,MADHOUSE,"Comedy, Drama, Mystery, Sci Fi, Slice of Life, Virtual Reality, Original Work"
Holo no Graffiti,hololive production,"Comedy, Episodic, Gag, Idols, Short Episodes, Slapstick, VTubers, CG Animation, Original Work"
"Say ""I love you.""",Zexcs,"Drama, Romance, Shoujo, Slice of Life, School Life, Based on a Manga, Bullying,, Emotional Abuse"
Golden Time,J.C.Staff,"Comedy, Drama, Romance, Adult Couples, Amnesia, Childhood Promise, College, Coming of Age, Love Triangle, Mature Romance, School Life, Based on a Light Novel"
Scissor Seven Specials,Sharefun Studio,"Action, Comedy, Birds, Chinese Animation, Short Episodes"
Love Stage!!,J.C.Staff,"BL, Comedy, Romance, Shounen-ai, Acting, Adult Couples, Crossdressing, LGBT Themes, Lifestyle Change, Mature Romance, Otaku Culture, Romantic Comedy, Showbiz, Based on a Manga, Sexual Content"
Boruto: Naruto the Movie - The Day Naruto Became Hokage,Pierrot,"Comedy, Shounen, Ninja, Based on a Manga"
Seitokai Yakuindomo*,GoHands,"Comedy, Shounen, Crude, Newly Co-ed School, Parody, Satire, School Life, Student Council, Based on a 4-Koma Manga, Based on a Manga, Sexual Content"
Master Keaton OVA,MADHOUSE,"Adventure, Seinen, Detectives, Episodic, Espionage, Europe, Work Life, Based on a Manga"
Ling Jian Zun 2nd Season,Soyep,"Action, Fantasy, Ancient China, Chinese Animation, Cultivation, Short Episodes, Based on a Web Novel, CG Animation"
The Prince of Tennis II Specials,M.S.C.,"Shounen, Sports, Tennis, Based on a Manga"
The Garden of Sinners Movie 6: Fairy Tale. (Oblivion Recording),ufotable,"Drama, Mystery, Overpowered Main Characters, Supernatural, Based on a Light Novel, Cannibalism,, Drug Use,, Mature Themes,, Violence"
Hakuouki: Demon of the Fleeting Blossom OVA,Studio DEEN,"Reverse Harem, Parody, School Life, Short Episodes, Based on an Otome Game, Based on a Visual Novel"
Fairy Tail Movie 1: Phoenix Priestess,A-1 Pictures,"Action, Fantasy, Shounen, Magic, Based on a Manga"
Hinomaru Sumo,GONZO,"Action, Shounen, Sports, Hand to Hand Combat, Martial Arts, Sumo Wrestling, Wrestling, Based on a Manga"
Tamayura: Sotsugyou Shashin Movie 4 - Ashita,TYO Animations,"Slice of Life, Iyashikei, Photography, Original Work"
Drifters Specials,Hoods Entertainment,"Action, Fantasy, Seinen, Dark Fantasy, Person in a Strange World, Rebellions, Samurai, Based on a Manga, Explicit Violence"
The Prince of Tennis: Another Story - Kako to Mirai no Message,M.S.C.,"Shounen, Sports, Tennis, Based on a Manga"
Porco Rosso,Studio Ghibli,"Action, Adventure, Aviation, Curse, Europe, Pigs, Pirates, Based on a Manga"
"Problem Children Are Coming From Another World, Aren't They?",diomedea,"Action, Fantasy, High Stakes Games, Isekai, Overpowered Main Characters, Person in a Strange World, PVP, Summoned Into Another World, Superpowers, Based on a Light Novel"
To Love Ru: Darkness 2nd OVA,XEBEC,"Comedy, Ecchi, Harem, Romance, Sci Fi, Shounen, Slice of Life, Aliens, Love Triangle, Non-Human Protagonists, Panty Shots, Based on a Manga, Nudity,, Sexual Content"
Fullmetal Alchemist The Movie: Conqueror of Shamballa,Bones,"Shounen, Europe, Historical, Siblings, War, World War 2, Based on a Manga, Violence"
Goku Sayonara Zetsubou Sensei,SHAFT,"Comedy, Shounen, Slice of Life, Breaking the Fourth Wall, Dark Comedy, Gag, Parody, Satire, Teaching, Based on a Manga, Mature Themes,, Suicide"
Death Note Rewrite 1: Visions of a God,MADHOUSE,"Crime, Criminals, Detectives, Mind Games, Psychological, Psychopaths, Rivalries, Secret Identity, Serial Killers, Shinigami, Supernatural, Vigilantes, Based on a Manga"
Akudama Drive,Pierrot,"Action, Sci Fi, Crime, Criminals, Mercenaries, Outside World, Thriller, Original Work, Explicit Violence,, Mature Themes,, Suicide"
School Rumble: Extra Class,Studio Comet,"Comedy, Shounen, Gag, Romantic Comedy, School Life, Based on a Manga"
L.O.R.D: Legend of Ravaging Dynasties,Original Force,"Action, Fantasy, Chinese Animation, CG Animation, Original Work, Violence"
Kobato.,MADHOUSE,"Comedy, Fantasy, Seinen, Iyashikei, Based on a Manga"
Kill La Kill Special,TRIGGER,"Action, Comedy, Ecchi, Sci Fi, Aliens, Superpowers, Swordplay, Original Work"
Ie Naki Ko Remi,Nippon Animation,"19th Century, Historical, World Masterpiece Theater, Based on a Novel"
Ani ni Tsukeru Kusuri wa Nai! 2,Fanworks,"Comedy, Slice of Life, Chinese Animation, School Life, Short Episodes, Siblings, Based on a Webtoon"
Azumanga Daioh,J.C.Staff,"Comedy, Shounen, Slice of Life, Episodic, Gag, Iyashikei, School Life, Based on a 4-Koma Manga, Based on a Manga"
The Slime Diaries: That Time I Got Reincarnated as a Slime,8-Bit,"Adventure, Comedy, Fantasy, Shounen, Slice of Life, Isekai, Kingdom Building, Management, Monsters, Non-Human Protagonists, Person in a Strange World, Reincarnation, Slimes, Based on a 4-Koma Manga, Based on a Manga"
Quanzhi Fashi IV,Foch,"Action, Fantasy, Chinese Animation, Elemental Powers, Magic, School Life, Supernatural, Urban Fantasy, Based on a Web Novel"
Durarara!! X2 The Third Arc: Dufufufu!,Shuka,"Supernatural, Based on a Light Novel"
Aria the OVA: Arietta,Hal Film Maker,"Sci Fi, Shounen, Slice of Life, Ocean, Based on a Manga"
The Dog of Flanders Movie,Nippon Animation,"Drama, 19th Century, Countryside, Dogs, Europe, Historical, Melancholy, Orphans, Pets, Poverty, Based on a Novel, Animal Abuse,, Mature Themes"
Nura: Rise of the Youkai Clan,Studio DEEN,"Action, Comedy, Shounen, Demons, Japanese Mythology, Monsters, Supernatural, Swordplay, Youkai, Based on a Manga"
Free! - Iwatobi Swim Club Specials,Animation Do,"Comedy, Sports, Childhood Friends, School Club, Swimming, Based on a Light Novel"
The God of High School,MAPPA,"Action, Fantasy, Hand to Hand Combat, Martial Arts, Superpowers, Tournaments, Based on a Webtoon, Violence"
Beyond the Boundary,Kyoto Animation,"Action, Drama, Fantasy, Contemporary Fantasy, Magic, School Life, Urban Fantasy, Based on a Light Novel"
Genshiken 2,ARMS,"Comedy, Drama, Ecchi, Seinen, Slice of Life, College, Doujinshi Industry, Manga Industry, Otaku Culture, Parody, Satire, School Club, School Life, Based on a Manga"
Inu X Boku Secret Service Special,David Production,"Comedy, Romance, Shounen, Age Gap, Apartment Life, Bodyguards, Contemporary Fantasy, Japanese Mythology, Neighbors, Non-Human Protagonists, Supernatural, Youkai, Based on a Manga"
The Irregular at Magic High School Movie: The Girl Who Summons the Stars,8-Bit,"Action, Drama, Sci Fi, Island, Magic, Military, Based on a Light Novel"
Kingdom,IKIF+,"Action, Drama, Seinen, Ancient China, Historical, Political, Rebellions, Royalty, Swordplay, War, Based on a Manga, CG Animation"
Interviews with Monster Girls: The Demi-chans' Summer Break,A-1 Pictures,"Comedy, Seinen, Slice of Life, Monster Girls, Supernatural, Vampires, Based on a Manga"
Kabaneri of the Iron Fortress Movie: The Battle of Unato,WIT Studio,"Action, Drama, Fantasy, Horror, Apocalypse, Dark Fantasy, Guns, Pandemic, Steampunk, Trains, Zombies, Original Work, Violence"
Detective Conan: The Burning Galactic Railway,TMS Entertainment,"Adventure, Mystery, Based on a Manga"
Quanzhi Fashi V,Foch,"Action, Fantasy, Chinese Animation, Elemental Powers, Magic, School Life, Supernatural, Urban Fantasy, Based on a Web Novel"
Ghost in the Shell: Arise,Production I.G,"Action, Sci Fi, Cyberpunk, Cyborgs, Based on a Manga"
Rurouni Kenshin Movie,Gallop,"Drama, Shounen, 19th Century, Feudal Japan, Historical, Samurai, Swordplay, Based on a Manga"
Naruto Shippuden Movie 5: Blood Prison,Pierrot,"Action, Shounen, Island, Ninja, Prison, Based on a Manga"
Saga of Tanya the Evil: Operation Desert Pasta,NUT,"Action, Fantasy, Seinen, Desert, Food and Beverage, Guns, Isekai, Magic, Military, Person in a Strange World, Reincarnation, Shorts, War, Based on a Light Novel"
Fate/stay night: Unlimited Blade Works Movie,Studio DEEN,"Action, Fantasy, Contemporary Fantasy, Magic, Superpowers, Urban Fantasy, Based on a Visual Novel, Violence"
Yowamushi Pedal The Movie,8 Pan,"Shounen, Sports, Cycling, Racing, School Club, School Life, Tournaments, Based on a Manga"
A Day Before Us ZERO,LICO,"Romance, Korean Animation, Short Episodes, Original Work"
High School DxD Hero,Passione,"Action, Ecchi, Fantasy, Harem, Shounen, Angels, Contemporary Fantasy, Demons, Japanese Mythology, Newly Co-ed School, Non-Human Protagonists, Norse Mythology, School Life, Based on a Light Novel, Nudity,, Sexual Content"
Chivalry of a Failed Knight,Nexus,"Action, Comedy, Ecchi, Fantasy, Contemporary Fantasy, Elemental Powers, Magic, Magic School, School Life, Swordplay, Tournaments, Urban Fantasy, Based on a Light Novel"
Saiyuki Reload: Burial,ARMS,"Action, Adventure, Comedy, Fantasy, Josei, Journey to the West, Based on a Manga"
Hidamari Sketch x Hoshimittsu Specials,SHAFT,"Comedy, Seinen, Slice of Life, Art, Art School, Based on a 4-Koma Manga, Based on a Manga"
Zan Sayonara Zetsubou Sensei Bangaichi,SHAFT,"Comedy, Shounen, Slice of Life, Breaking the Fourth Wall, Dark Comedy, Gag, Parody, Satire, Teaching, Based on a Manga"
Last Exile,GONZO,"Adventure, Fantasy, Sci Fi, Aviation, Military, Steampunk, Original Work"
Days 2nd Season,MAPPA,"Comedy, Drama, Shounen, Sports, School Life, Soccer, Based on a Manga"
The Morose Mononokean,St. Signpost,"Fantasy, Shounen, Contemporary Fantasy, Exorcists, Iyashikei, Japanese Mythology, Lifestyle Change, School Life, Supernatural, Youkai, Based on a Manga"
Ni Tian Zhizun,Soyep,"Action, Fantasy, Chinese Animation, Short Episodes, Based on a Web Novel, CG Animation"
Boruto: Naruto the Movie,Pierrot,"Action, Shounen, Ninja, Based on a Manga"
Ani ni Tsukeru Kusuri wa Nai! 3,Fanworks,"Comedy, Slice of Life, Chinese Animation, School Life, Short Episodes, Siblings, Based on a Webtoon"
Grimgar of Fantasy and Ash,A-1 Pictures,"Action, Adventure, Drama, Fantasy, Guilds, Isekai, MMORPG, Monsters, Person in a Strange World, RPG, Weak to Strong, Based on a Light Novel, Violence"
FLCL,GAINAX,"Action, Comedy, Romance, Sci Fi, Coming of Age, Non-Human Protagonists, Robots, Slapstick, Original Work"
Carnival Phantasm,Lerche,"Comedy, Fantasy, Crossover, Gag, Parody, Based on a Manga"
Wan Jie Xian Zong 4th Season,Ruo Hong Culture,"Action, Fantasy, Ancient China, Chinese Animation, Cultivation, Short Episodes, Based on a Manga"
Fairy Tail OVA,A-1 Pictures,"Comedy, Fantasy, Shounen, Magic, Based on a Manga"
Digimon Adventure Tri. Movie 2: Determination,Toei Animation,"Action, Drama, Sci Fi, Monsters"
Kino's Journey: Life Goes On,A.C.G.T,"Adventure, Drama, Fantasy, Coming of Age, Melancholy, Motorcycles, Based on a Light Novel, Violence"
InuYasha The Movie 3: Swords of an Honorable Ruler,Sunrise,"Action, Fantasy, Shounen, Animal Characteristics, Feudal Japan, Non-Human Protagonists, Person in a Strange World, Swordplay, Based on a Manga"
To Love Ru: Darkness OVA,XEBEC,"Comedy, Ecchi, Harem, Romance, Sci Fi, Shounen, Slice of Life, Aliens, Love Triangle, Non-Human Protagonists, Panty Shots, Based on a Manga, Nudity,, Sexual Content"
Tiger & Bunny The Movie: The Rising,Sunrise,"Action, Comedy, Sci Fi, Superheroes, Superpowers, Original Work"
Towanoquon Movie 6: Eternal Quon,Bones,"Sci Fi, Supernatural, Superpowers, Original Work"
Sora no Aosa wo Shiru Hito yo,CloverWorks,"Drama, Romance, Music, Time Travel, Unrequited Love, Original Work"
Lupin III: Jigen's Gravestone,Telecom Animation Film,"Action, Criminals, Guns, Noir, Thieves, Explicit Violence,, Nudity"
Hidamari Sketch x Hoshimittsu,SHAFT,"Comedy, Seinen, Slice of Life, Art, Art School, Boarding House, Iyashikei, Neighbors, School Life, Based on a 4-Koma Manga, Based on a Manga"
Nisekoi,SHAFT,"Comedy, Harem, Romance, Shounen, Slice of Life, Childhood Promise, Fake Romance, Gangs, Romantic Comedy, School Life, Tsundere, Yakuza, Based on a Manga"
To Love Ru: Darkness,XEBEC,"Comedy, Ecchi, Harem, Romance, Sci Fi, Shounen, Slice of Life, Aliens, Cohabitation, Interspecies Relationship, Love Triangle, Non-Human Protagonists, Panty Shots, Royalty, School Life, Based on a Manga, Nudity,, Sexual Content"
Mobile Suit Gundam SEED,Sunrise,"Action, Drama, Mecha, Sci Fi, Outer Space, Real Robot, Rivalries, War, Original Work, Sexual Content"
Legend of the Galactic Heroes: Die Neue These,Production I.G,"Drama, Sci Fi, Military, Outer Space, Political, Space Opera, War, Based on a Novel, Violence"
Hetalia: World Series Extra Episodes,Studio DEEN,"Comedy, Anthropomorphic, Chibi, Gag, Historical, Parody, Political, Satire, Short Episodes, Based on a Manga"
Yuru Yuri Nachu Yachumi!+,TYO Animations,"Comedy, Seinen, Slice of Life, Based on a Manga"
Out of Sight,Summer 2010,"Adventure, Disability, Family Friendly, Shorts"
Saint Seiya: The Hades Chapter - Inferno,Toei Animation,"Action, Fantasy, Sci Fi, Shounen, Hand to Hand Combat, Power Suits, Superpowers, Violence"
Cardcaptor Sakura,MADHOUSE,"Fantasy, Magical Girl, Shoujo, Contemporary Fantasy, Family Friendly, Henshin Heroes, Magic, Monster-of-the-week, Urban Fantasy, Based on a Manga"
Rilakkuma and Kaoru,Dwarf,"Slice of Life, Animal Protagonists, Anthropomorphic, Bears, Family Friendly, Non-Human Protagonists, San-X Characters, Short Episodes, Stop Motion Animation"
Dragon Ball Z Movie 14: Battle of Gods,Toei Animation,"Action, Comedy, Shounen, Aliens, Gods, Hand to Hand Combat, Martial Arts, Non-Human Protagonists, Superpowers, Based on a Manga"
The Royal Tutor Movie,Tear Studio,"Drama, Shounen, Chibi, Historical, Royalty, Siblings, Teaching, Tutors, Based on a Manga"
Yamada-kun and the Seven Witches,LIDEN FILMS,"Comedy, Romance, Shounen, Body Swapping, Gender Bender, Romantic Comedy, School Club, School Life, Supernatural, Witches, Based on a Manga"
Kuma Kuma Kuma Bear,EMT Squared,"Adventure, Comedy, Fantasy, Bears, Isekai, Magic, Monsters, Overpowered Main Characters, Person in a Strange World, RPG, Based on a Light Novel"
Is this a Zombie? Of the Dead,Studio DEEN,"Comedy, Ecchi, Fantasy, Magical Girl, Shounen, Contemporary Fantasy, Crossdressing, Henshin Heroes, Magic, Parody, School Life, Urban Fantasy, Zombies, Based on a Light Novel"
She and Her Cat: Everything Flows,LIDEN FILMS Kyoto Studio,"Drama, Slice of Life, Animal Protagonists, Cats, Family Friendly, Loneliness, Melancholy, Non-Human Protagonists, Pets, Short Episodes, Original Work"
Tegami Bachi: Letter Bee Reverse,St. Signpost,"Fantasy, Shounen, Insects, Steampunk, Based on a Manga"
Love Stage!! OVA,J.C.Staff,"BL, Comedy, Romance, Shounen-ai, Adult Couples, LGBT Themes, Mature Romance, Based on a Manga"
Maria Watches Over Us Season 3,Studio DEEN,"Drama, GL, Shoujo-ai, School Life, Based on a Light Novel"
Tekkon Kinkreet,Studio 4°C,"Action, Drama, Fantasy, Seinen, Codependency, Gangs, Psychological, Urban Fantasy, Yakuza, Based on a Manga, Violence"
Aggretsuko (2016),Fanworks,"Comedy, Slice of Life, Animal Protagonists, Anthropomorphic, Coworkers, Non-Human Protagonists, Sanrio Characters, Short Episodes, Work Life, Original Work"
Haibane Renmei,Radix Ace Entertainment,"Drama, Fantasy, Slice of Life, Afterlife, Amnesia, Angels, Countryside, Based on a Doujinshi"
The Ancient Magus' Bride: The Boy from the West and the Knight of the Blue Storm,Studio Kafka,"Drama, Fantasy, Romance, Apprenticeship, Contemporary Fantasy, England, Europe, Interspecies Relationship, Magic, Non-Human Protagonists, Orphans, Based on a Manga"
Baka and Test - Summon the Beasts OVA,SILVER LINK.,"Comedy, School Life, Based on a Light Novel"
One-Punch Man 2 Specials,J.C.Staff,"Comedy, Seinen, Slice of Life, Overpowered Main Characters, Superheroes, Superpowers, Based on a Manga"
ORESUKI: Are you the only one who loves me? Ore-tachi no Game Set,CONNECT,"Comedy, Harem, Romance, Shounen, Romantic Comedy, Based on a Light Novel"
School Rumble,Studio Comet,"Comedy, Romance, Shounen, Delinquents, Episodic, Gag, Love Triangle, Romantic Comedy, School Life, Unrequited Love, Based on a Manga"
Goblin Slayer: Goblin's Crown,WHITE FOX,"Action, Adventure, Fantasy, Seinen, Dark Fantasy, Medieval, Monsters, Based on a Light Novel, Explicit Violence,, Mature Themes,, Physical Abuse"
Mobile Suit Gundam 00 Special Edition II: End of World,Sunrise,"Action, Mecha, Sci Fi, Real Robot, Original Work"
Working!!,A-1 Pictures,"Comedy, Romance, Seinen, Slice of Life, Androphobia, Coworkers, Restaurants, Work Life, Based on a 4-Koma Manga, Based on a Manga"
Thus Spoke Kishibe Rohan,David Production,"Horror, Mystery, Shounen, Supernatural, Based on a Manga, Explicit Violence"
Special A,AIC,"Comedy, Romance, Shoujo, Rivalries, Romantic Comedy, Based on a Manga"
Cells at Work!!,David Production,"Action, Comedy, Shounen, Anthropomorphic, Educational, Episodic, Medical, Non-Human Protagonists, Based on a Manga, Violence"
Mobile Suit Gundam 00 Special Edition I: Celestial Being,Sunrise,"Action, Mecha, Sci Fi, Real Robot, Original Work"
The Familiar of Zero F,J.C.Staff,"Comedy, Fantasy, Isekai, Magic, Magic School, Master-Servant Relationship, Person in a Strange World, School Life, Tsundere, Based on a Light Novel"
Hybrid Child,Studio DEEN,"BL, Drama, Romance, Shounen-ai, Androids, Feudal Japan, Historical, Non-Human Protagonists, Robots, Samurai, Based on a Manga"
The Prince of Tennis Movie 2: Eikoku-shiki Teikyuu Shiro Kessen!,M.S.C.,"Shounen, Sports, Tennis, Based on a Manga"
Sweetness & Lightning,3xCube,"Comedy, Drama, Seinen, Slice of Life, Anime no Me, Childcare, Cooking, Death of a Loved One, Family Life, Food and Beverage, Iyashikei, Recipes, Single Parent, Based on a Manga"
Hidamari Sketch x 365,SHAFT,"Comedy, Seinen, Slice of Life, Art, Art School, Boarding House, Iyashikei, Neighbors, School Life, Based on a 4-Koma Manga, Based on a Manga"
My Hero Academia: Training of the Dead,Bones,"Action, Comedy, Sci Fi, Shounen, Superheroes, Superpowers, Based on a Manga"
High School DxD,TNK,"Action, Ecchi, Fantasy, Harem, Shounen, Contemporary Fantasy, Demons, Newly Co-ed School, School Life, Based on a Light Novel, Nudity,, Sexual Content"
