Name,Studio,Genres
Demon Slayer: Kimetsu no Yaiba - Entertainment District Arc,ufotable,"Action, Adventure, Fantasy, Shounen, Demons, Historical, Martial Arts, Orphans, Siblings, Swordplay, Based on a Manga, Explicit Violence"
Fruits Basket the Final Season,TMS Entertainment,"Drama, Fantasy, Romance, Shoujo, Animal Transformation, Contemporary Fantasy, Curse, Dysfunctional Families, Mental Illness, Orphans, Based on a Manga, Emotional Abuse,, Mature Themes,, Physical Abuse,, Suicide,, Violence,, Domestic Abuse"
Mo Dao Zu Shi 3,B.C MAY PICTURES,"Fantasy, Ancient China, Chinese Animation, Cultivation, Xianxia, Based on a Web Novel"
Fullmetal Alchemist: Brotherhood,Bones,"Action, Adventure, Drama, Fantasy, Mystery, Shounen, Conspiracy, Death of a Loved One, Military, Siblings, Based on a Manga, Animal Abuse,, Mature Themes,, Violence,, Domestic Abuse"
Attack on Titan 3rd Season: Part II,WIT Studio,"Action, Fantasy, Horror, Shounen, Dark Fantasy, Isolated Society, Military, Outside World, Post-apocalyptic, Based on a Manga, Cannibalism,, Explicit Violence"
Jujutsu Kaisen,MAPPA,"Action, Horror, Shounen, Curse, Exorcists, Monsters, School Life, Supernatural, Based on a Manga, Explicit Violence"
Attack on Titan The Final Season: Part II,MAPPA,"Action, Drama, Fantasy, Horror, Shounen, Dark Fantasy, Military, War, Based on a Manga"
Attack on Titan The Final Season,MAPPA,"Action, Drama, Fantasy, Horror, Shounen, Dark Fantasy, Military, War, Based on a Manga, Explicit Violence,, Mature Themes,, Physical Abuse,, Suicide"
Demon Slayer: Kimetsu no Yaiba Movie - Mugen Train,ufotable,"Action, Drama, Fantasy, Shounen, Demons, Historical, Martial Arts, Orphans, Siblings, Swordplay, Trains, Based on a Manga, Mature Themes,, Suicide,, Violence"
Haikyuu!! Karasuno High School vs Shiratorizawa Academy,Production I.G,"Shounen, Sports, Animeism, School Club, School Life, Tournaments, Volleyball, Based on a Manga"
your name.,CoMix Wave Films,"Drama, Romance, Body Swapping, Gender Bender, Opposites Attract, School Life, Supernatural, Original Work"
Haikyuu!! Second Season,Production I.G,"Shounen, Sports, School Club, School Life, Tournaments, Volleyball, Based on a Manga"
Demon Slayer: Kimetsu no Yaiba,ufotable,"Action, Adventure, Comedy, Drama, Fantasy, Shounen, Death of a Loved One, Demons, Historical, Martial Arts, Orphans, Siblings, Swordplay, Based on a Manga, Violence"
Hunter x Hunter (2011),MADHOUSE,"Action, Adventure, Drama, Fantasy, Shounen, Monsters, Superpowers, Based on a Manga, Violence"
A Silent Voice,Kyoto Animation,"Drama, Shounen, Disability, Melancholy, Mental Illness, School Life, Based on a Manga, Bullying,, Mature Themes,, Suicide"
Violet Evergarden Movie,Kyoto Animation,"Drama, Melancholy, War, Based on a Light Novel, Violence"
Haikyuu!! To the Top: Part II,Production I.G,"Shounen, Sports, Animeism, School Club, Tournaments, Volleyball, Based on a Manga"
Heaven Official's Blessing Special,Haoliners Animation League,"BL, Romance, Shounen-ai, Afterlife, Ancient China, Chinese Animation, Demon King, Ghosts, Gods, Interspecies Relationship, Non-Human Protagonists, Opposites Attract, Royalty, Supernatural, Xianxia, Based on a Web Novel"
That Time I Got Reincarnated as a Slime Season 2,8-Bit,"Action, Adventure, Fantasy, Shounen, Cheats, Demons, Isekai, Kingdom Building, Magic, Management, Modern Knowledge, Monsters, Person in a Strange World, Political, Reincarnation, RPG, Slimes, Based on a Manga"
Given,Lerche,"BL, Drama, Romance, Shounen-ai, Death of a Loved One, Music, noitaminA, Based on a Manga, Mature Themes,, Suicide"
Code Geass: Lelouch of the Rebellion R2,Sunrise,"Mecha, Sci Fi, Conspiracy, Mind Games, Overpowered Main Characters, Political, Psychological, Real Robot, Rebellions, Rivalries, Royalty, Secret Identity, Superpowers, Terrorism, Original Work"
Mo Dao Zu Shi 2,B.C MAY PICTURES,"Action, Fantasy, Mystery, Ancient China, Chinese Animation, Cultivation, Historical, Martial Arts, Overpowered Main Characters, Supernatural, Swordplay, War, Xianxia, Zombies, Based on a Web Novel, Violence"
Gintama: The Very Final,BN Pictures,"Action, Comedy, Drama, Sci Fi, Shounen, Aliens, Feudal Japan, Gag, Parody, Samurai, Swordplay, Based on a Manga, Violence"
Link Click,Studio LAN,"Drama, Fantasy, Chinese Animation, Contemporary Fantasy, Superpowers, Time Travel, Urban Fantasy, Original Work, Violence"
Mob Psycho 100 II,Bones,"Action, Comedy, Exorcists, Psychic Powers, Psychological, School Life, Supernatural, Superpowers, Based on a Manga, Violence"
Haikyuu!! To the Top,Production I.G,"Shounen, Sports, Animeism, School Club, Tournaments, Volleyball, Based on a Manga"
Fruits Basket 2nd Season,8 Pan,"Comedy, Drama, Fantasy, Romance, Shoujo, Animal Transformation, Contemporary Fantasy, Curse, Dysfunctional Families, Love Triangle, Mental Illness, Orphans, Based on a Manga, Bullying,, Emotional Abuse,, Mature Themes,, Physical Abuse,, Domestic Abuse"
The Promised Neverland,CloverWorks,"Fantasy, Horror, Mystery, Sci Fi, Shounen, Dark Fantasy, Isolated Society, Mind Games, noitaminA, Orphans, Outside World, Psychological, Thriller, Based on a Manga, Mature Themes,, Domestic Abuse,, Self-Harm"
Spirited Away,Studio Ghibli,"Adventure, Fantasy, Curse, Family Friendly, Japanese Mythology, Magic, Person in a Strange World, Youkai, Original Work"
That Time I Got Reincarnated as a Slime Season 2: Part II,8-Bit,"Action, Adventure, Fantasy, Shounen, Cheats, Demons, Isekai, Kingdom Building, Magic, Management, Modern Knowledge, Monsters, Person in a Strange World, Political, Reincarnation, RPG, Slimes, Based on a Manga, Physical Abuse"
Heaven Official's Blessing,Haoliners Animation League,"Action, BL, Comedy, Drama, Romance, Shounen-ai, Afterlife, Ancient China, Chinese Animation, Demon King, Demons, Ghosts, Gods, Heaven, Historical, Interspecies Relationship, Non-Human Protagonists, Opposites Attract, Religion, Royalty, Supernatural, Xianxia, Based on a Web Novel, Bullying,, Violence"
Ranking of Kings,WIT Studio,"Action, Adventure, Fantasy, Coming of Age, Disability, Royalty, Based on a Manga, Violence"
Mushoku Tensei: Jobless Reincarnation - Part II,Studio Bind,"Action, Adventure, Drama, Fantasy, Romance, Demons, Isekai, Magic, NEET, Person in a Strange World, Reincarnation, Based on a Light Novel, Mature Themes,, Violence"
Gintama.: Shirogane no Tamashii-hen 2,BN Pictures,"Action, Comedy, Drama, Sci Fi, Shounen, Aliens, Crude, Feudal Japan, Gag, Samurai, Slapstick, Swordplay, Based on a Manga"
Clannad After Story,Kyoto Animation,"Drama, Romance, Adult Couples, Coming of Age, Family Life, Illness, Based on a Visual Novel, Drug Use,, Mature Themes"
Mo Dao Zu Shi,B.C MAY PICTURES,"Action, Adventure, Mystery, Ancient China, Chinese Animation, Cultivation, Historical, Rebellions, Supernatural, Swordplay, War, Xianxia, Zombies, Based on a Web Novel, Violence"
Gintama': Enchousen,Sunrise,"Action, Comedy, Drama, Sci Fi, Shounen, Aliens, Crude, Feudal Japan, Gag, Parody, Samurai, Slapstick, Swordplay, Based on a Manga"
Banana Fish,MAPPA,"Action, Drama, Shoujo, America, Criminals, Gangs, noitaminA, Based on a Manga, Drug Use,, Mature Themes,, Physical Abuse,, Prostitution,, Sexual Abuse,, Violence"
Douluo Dalu 2,Sparkly Key Animation Studio,"Action, Fantasy, Chinese Animation, Cultivation, Xianxia, Based on a Web Novel, CG Animation"
Gintama Kanketsu-hen: Yorozuya yo Eien Nare,Sunrise,"Action, Comedy, Drama, Sci Fi, Shounen, Aliens, Feudal Japan, Samurai, Swordplay, Time Travel, Based on a Manga"
Gintama.,BN Pictures,"Action, Comedy, Drama, Sci Fi, Shounen, Aliens, Crude, Feudal Japan, Gag, Samurai, Slapstick, Swordplay, Based on a Manga"
Gintama.: Shirogane no Tamashii-hen,BN Pictures,"Action, Comedy, Drama, Sci Fi, Shounen, Aliens, Crude, Feudal Japan, Gag, Samurai, Slapstick, Swordplay, Based on a Manga"
Attack on Titan 3rd Season,WIT Studio,"Action, Fantasy, Horror, Dark Fantasy, Isolated Society, Military, Outside World, Political, Post-apocalyptic, Based on a Manga, Cannibalism,, Explicit Violence"
Steins;Gate,WHITE FOX,"Sci Fi, Conspiracy, LGBT Themes, Psychological, Thriller, Time Travel, Based on a Visual Novel, Mature Themes,, Suicide"
Haikyuu!!,Production I.G,"Shounen, Sports, School Club, School Life, Tournaments, Volleyball, Based on a Manga"
Gintama',Sunrise,"Action, Comedy, Drama, Sci Fi, Shounen, Aliens, Breaking the Fourth Wall, Crude, Feudal Japan, Gag, Parody, Samurai, Slapstick, Swordplay, Based on a Manga"
One-Punch Man,MADHOUSE,"Action, Comedy, Sci Fi, Seinen, Cyborgs, Monsters, Overpowered Main Characters, Parody, Satire, Superheroes, Superpowers, Based on a Manga, Explicit Violence"
Demon Slayer: Kimetsu no Yaiba - Mugen Train,ufotable,"Action, Drama, Fantasy, Shounen, Demons, Historical, Orphans, Siblings, Swordplay, Trains, Based on a Manga, Mature Themes,, Suicide,, Violence"
Gintama°,BN Pictures,"Action, Comedy, Drama, Sci Fi, Shounen, Aliens, Breaking the Fourth Wall, Crude, Feudal Japan, Gag, Parody, Samurai, Slapstick, Swordplay, Based on a Manga"
Howl's Moving Castle,Studio Ghibli,"Adventure, Fantasy, Romance, Curse, Family Friendly, Lifestyle Change, Magic, Witches, Based on a Novel"
Natsume's Book of Friends Season 6,Shuka,"Drama, Fantasy, Shoujo, Bodyguards, Cats, Countryside, Episodic, Iyashikei, Japanese Mythology, Orphans, Supernatural, Youkai, Based on a Manga"
JoJo's Bizarre Adventure: Golden Wind,David Production,"Action, Adventure, Shounen, Europe, Italy, Supernatural, Based on a Manga, Animal Abuse,, Mature Themes"
JoJo's Bizarre Adventure: Stone Ocean,David Production,"Action, Adventure, Shounen, America, Prison, Supernatural, Based on a Manga"
Vinland Saga,WIT Studio,"Action, Seinen, Death of a Loved One, England, Europe, Historical, Medieval, Revenge, Swordplay, War, Weak to Strong, Based on a Manga, Violence"
Natsume's Book of Friends Season 4,Brain's Base,"Drama, Shoujo, Slice of Life, Bodyguards, Cats, Countryside, Episodic, Iyashikei, Japanese Mythology, Orphans, Supernatural, Youkai, Based on a Manga"
Assassination Classroom 2nd Season,Lerche,"Action, Comedy, Sci Fi, Shounen, Assassins, Non-Human Protagonists, Overpowered Main Characters, Parody, School Life, Teaching, Based on a Manga"
Natsume's Book of Friends Season 5,Shuka,"Drama, Shoujo, Slice of Life, Bodyguards, Cats, Countryside, Episodic, Iyashikei, Japanese Mythology, Orphans, Supernatural, Youkai, Based on a Manga"
My Hero Academia 3,Bones,"Action, Comedy, Drama, Sci Fi, Shounen, Superheroes, Superpowers, Based on a Manga, Violence"
Violet Evergarden,Kyoto Animation,"Drama, Lifestyle Change, Melancholy, War, Based on a Light Novel, Violence"
That Time I Got Reincarnated as a Slime,8-Bit,"Action, Adventure, Comedy, Fantasy, Shounen, Cheats, Demons, Isekai, Kingdom Building, Magic, Management, Modern Knowledge, Monsters, Non-Human Protagonists, Overpowered Main Characters, Person in a Strange World, Political, Reincarnation, RPG, Slimes, Based on a Manga, Violence"
My Hero Academia 2,Bones,"Action, Comedy, Drama, Sci Fi, Shounen, School Life, Superheroes, Superpowers, Tournaments, Weak to Strong, Based on a Manga, Emotional Abuse,, Mature Themes,, Physical Abuse,, Violence,, Domestic Abuse"
Wolf Children,Studio Chizu,"Fantasy, Slice of Life, Animal Characteristics, Animal Transformation, Childcare, Coming of Age, Contemporary Fantasy, Countryside, Death of a Loved One, Family Life, Lifestyle Change, Single Parent, Werewolves, Original Work, Nudity"
SK8 the Infinity,Bones,"Comedy, Sports, Racing, Original Work, Emotional Abuse,, Mature Themes,, Physical Abuse,, Domestic Abuse"
Hajime no Ippo: The Fighting!,MADHOUSE,"Action, Drama, Shounen, Sports, Boxing, Hand to Hand Combat, Weak to Strong, Based on a Manga"
Code Geass: Lelouch of the Rebellion,Sunrise,"Mecha, Sci Fi, Conspiracy, Mind Games, Overpowered Main Characters, Political, Psychological, Real Robot, Rebellions, Revenge, Rivalries, Royalty, Secret Identity, Superpowers, Terrorism, Original Work, Nudity,, Violence"
JoJo’s Bizarre Adventure: Stardust Crusaders - Battle in Egypt,David Production,"Action, Adventure, Comedy, Shounen, Monster-of-the-week, Proxy Battles, Supernatural, Based on a Manga, Animal Abuse,, Explicit Violence,, Mature Themes"
Yona of the Dawn: Zeno Arc,Pierrot,"Action, Adventure, Drama, Fantasy, Romance, Shoujo, Death of a Loved One, Orphans, Political, Royalty, Based on a Manga, Violence"
JoJo's Bizarre Adventure: Diamond is Unbreakable,David Production,"Action, Mystery, Shounen, Proxy Battles, Supernatural, Based on a Manga, Animal Abuse,, Mature Themes,, Violence"
Kamisama Kiss: Kako-hen,TMS Entertainment,"Comedy, Romance, Shoujo, Animal Characteristics, Interspecies Relationship, Japanese Mythology, Master-Servant Relationship, Non-Human Protagonists, Based on a Manga"
Hajime no Ippo: New Challenger,MADHOUSE,"Action, Drama, Shounen, Sports, Boxing, Hand to Hand Combat, Tournaments, Based on a Manga"
Mushishi Zoku Shou 2nd Season,Artland,"Fantasy, Seinen, Episodic, Iyashikei, Supernatural, Based on a Manga"
Attack on Titan,WIT Studio,"Action, Fantasy, Horror, Shounen, Dark Fantasy, Death of a Loved One, Isolated Society, Military, Outside World, Overpowered Main Characters, Post-apocalyptic, Revenge, Based on a Manga, Cannibalism,, Explicit Violence,, Mature Themes,, Suicide"
Haikyuu!! Tokushuu! Harukou Volley ni Kaketa Seishun,Production I.G,"Shounen, Sports, Recap, Volleyball, Based on a Manga"
Kaguya-sama: Love Is War?,A-1 Pictures,"Comedy, Drama, Romance, Seinen, Episodic, Love Confession, Mind Games, School Life, Student Council, Based on a Manga"
Gintama: Porori-hen,BN Pictures,"Action, Comedy, Drama, Sci Fi, Shounen, Aliens, Crude, Feudal Japan, Gag, Samurai, Slapstick, Swordplay, Based on a Manga"
March Comes in like a Lion 2nd Season,SHAFT,"Drama, Seinen, Slice of Life, Board Games, Melancholy, Orphans, Psychological, Based on a Manga, Bullying,, Emotional Abuse"
Natsume's Book of Friends Season 3,Brain's Base,"Drama, Shoujo, Slice of Life, Bodyguards, Cats, Countryside, Episodic, Iyashikei, Japanese Mythology, Orphans, Supernatural, Youkai, Based on a Manga"
Attack on Titan 2nd Season,WIT Studio,"Action, Fantasy, Horror, Shounen, Dark Fantasy, Isolated Society, Military, Outside World, Overpowered Main Characters, Post-apocalyptic, Based on a Manga, Cannibalism,, Explicit Violence"
I Want to Eat Your Pancreas,Studio VOLN,"Drama, Romance, Seinen, Coming of Age, Illness, Opposites Attract, School Life, Based on a Novel"
Rascal Does Not Dream of a Dreaming Girl,CloverWorks,"Drama, Romance, Illness, Senpai-Kouhai Relationship, Supernatural, Time Travel, Based on a Light Novel"
Given Movie,Lerche,"BL, Drama, Romance, Shounen-ai, Adult Couples, Codependency, Love Triangle, Mature Romance, Music, Based on a Manga, Emotional Abuse,, Mature Themes,, Physical Abuse,, Sexual Abuse,, Sexual Content"
Mushishi Zoku Shou,Artland,"Fantasy, Seinen, Episodic, Iyashikei, Supernatural, Based on a Manga"
Princess Mononoke,Studio Ghibli,"Action, Adventure, Fantasy, Curse, Environmental, Feudal Japan, Forest, Japanese Mythology, Royalty, Original Work"
Kuroko's Basketball 3,Production I.G,"Shounen, Sports, Basketball, School Club, Tournaments, Based on a Manga"
BTS: We are Bulletproof - the Eternal,Studio Pivote,"Chibi, Korean Animation"
Haikyuu!! Movie 4: Battle of Concepts,Production I.G,"Shounen, Sports, Recap, School Club, Tournaments, Volleyball, Based on a Manga"
Dr. Stone,8 Pan,"Adventure, Comedy, Sci Fi, Shounen, Person in a Strange World, Post-apocalyptic, Prehistoric, Survival, Based on a Manga"
Attack on Titan: No Regrets,WIT Studio,"Action, Fantasy, Shoujo, Dark Fantasy, Isolated Society, Military, Outside World, Post-apocalyptic, Based on a Manga, Cannibalism,, Explicit Violence"
Horimiya,CloverWorks,"Comedy, Romance, Shounen, Romantic Comedy, School Life, Based on a Manga"
Cowboy Bebop,Sunrise,"Action, Adventure, Drama, Sci Fi, Bounty Hunters, Episodic, Noir, Outer Space, Western, Original Work, Drug Use,, Mature Themes,, Nudity,, Violence"
Hotarubi no Mori e,Brain's Base,"Drama, Romance, Shoujo, Coming of Age, Forest, Japanese Mythology, Loneliness, Melancholy, Supernatural, Youkai, Based on a Manga"
The Disastrous Life of Saiki K. 2nd Season,J.C.Staff,"Comedy, Shounen, Slice of Life, Breaking the Fourth Wall, Gag, Psychic Powers, School Life, Supernatural, Superpowers, Based on a Manga"
Monogatari Series: Second Season,SHAFT,"Action, Comedy, Drama, Ecchi, Mystery, Romance, Supernatural, Tsundere, Based on a Light Novel, Explicit Violence"
Castlevania Season 4,Tiger Animation,"Action, Adventure, Drama, Horror, 15th Century, Europe, Historical, Magic, Medieval, Supernatural, Vampires, Based on a Video Game, Animal Abuse,, Explicit Violence,, Mature Themes,, Suicide"
Doukyuusei,A-1 Pictures,"BL, Drama, Romance, Shounen-ai, All-Boys School, LGBT Themes, Opposites Attract, School Life, Based on a Manga"
ERASED,A-1 Pictures,"Drama, Mystery, Seinen, Age Transformation, Crime, Death of a Loved One, Dysfunctional Families, Melancholy, noitaminA, Serial Killers, Supernatural, Thriller, Time Travel, Based on a Manga, Animal Abuse,, Mature Themes,, Physical Abuse,, Domestic Abuse"
The Rising of the Shield Hero,Kinema Citrus,"Action, Adventure, Drama, Fantasy, Seinen, Animal Characteristics, Betrayal, Dark Fantasy, Demons, Framed for a Crime, Isekai, Monsters, Person in a Strange World, RPG, Summoned Into Another World, Based on a Light Novel, Violence"
To Your Eternity,Brain's Base,"Adventure, Drama, Fantasy, Shounen, Animal Transformation, Melancholy, Non-Human Protagonists, Supernatural, Survival, Based on a Manga, Violence"
Hajime no Ippo: Rising,MADHOUSE,"Action, Drama, Shounen, Sports, Boxing, Hand to Hand Combat, Based on a Manga"
"Josee, the Tiger and the Fish",Bones,"Drama, Romance, Disability, Based on a Novel"
Made in Abyss,Kinema Citrus,"Adventure, Drama, Fantasy, Mystery, Sci Fi, Seinen, Androids, Curse, Dark Fantasy, Melancholy, Non-Human Protagonists, Orphans, Outside World, Psychological, Robots, Based on a Manga, Explicit Violence"
Rurouni Kenshin: Tsuiokuhen,Studio DEEN,"Drama, Romance, 19th Century, Feudal Japan, Historical, Melancholy, Samurai, Star-Crossed Lovers, Swordplay, Based on a Manga, Violence"
Descending Stories: Shouwa Genroku Rakugo Shinjuu,Studio DEEN,"Drama, Josei, Adult Couples, Animeism, Apprenticeship, Historical, Rakugo, Based on a Manga"
Haikyuu!! Movie 3: Talent and Sense,Production I.G,"Shounen, Sports, Recap, School Club, School Life, Tournaments, Volleyball, Based on a Manga"
Mo Dao Zu Shi Q,B.C MAY PICTURES,"Comedy, Ancient China, Chibi, Chinese Animation, Episodic, Historical, Short Episodes"
Natsume's Book of Friends Season 2,Brain's Base,"Drama, Shoujo, Slice of Life, Bodyguards, Cats, Countryside, Episodic, Iyashikei, Japanese Mythology, Orphans, Supernatural, Youkai, Based on a Manga"
Made in Abyss Movie: Dawn of the Deep Soul,Kinema Citrus,"Adventure, Fantasy, Horror, Mystery, Sci Fi, Seinen, Curse, Dark Fantasy, Human Experimentation, Non-Human Protagonists, Orphans, Outside World, Robots, Based on a Manga, Explicit Violence,, Nudity"
Fruits Basket 1st Season,TMS Entertainment,"Comedy, Drama, Fantasy, Romance, Shoujo, Animal Transformation, Contemporary Fantasy, Curse, Death of a Loved One, Dysfunctional Families, Love Triangle, Orphans, Slapstick, Based on a Manga, Bullying,, Emotional Abuse,, Mature Themes,, Physical Abuse"
Kizumonogatari Part 3: Reiketsu,SHAFT,"Action, Drama, Ecchi, Psychological, Supernatural, Vampires, Based on a Light Novel, Explicit Violence,, Nudity"
Dr. Stone: Stone Wars,8 Pan,"Adventure, Comedy, Sci Fi, Shounen, Person in a Strange World, Post-apocalyptic, Prehistoric, Survival, Based on a Manga"
My Hero Academia 4,Bones,"Action, Drama, Sci Fi, Shounen, Superheroes, Superpowers, Based on a Manga, Emotional Abuse,, Mature Themes,, Physical Abuse,, Violence"
Owarimonogatari II,SHAFT,"Drama, Mystery, Romance, Supernatural, Based on a Light Novel, Violence"
Great Teacher Onizuka,Pierrot,"Comedy, Drama, Shounen, Delinquents, School Life, Slapstick, Teaching, Work Life, Based on a Manga, Bullying,, Emotional Abuse"
Your lie in April,A-1 Pictures,"Drama, Romance, Shounen, Classical Music, Illness, Melancholy, Mental Illness, Music, noitaminA, Psychological, School Life, Tournaments, Unrequited Love, Based on a Manga, Mature Themes,, Physical Abuse,, Domestic Abuse"
Bungo Stray Dogs 3rd Season,Bones,"Action, Mystery, Seinen, Supernatural, Superpowers, Based on a Manga, Mature Themes,, Suicide,, Violence"
Kamisama Kiss 2nd Season,TMS Entertainment,"Comedy, Fantasy, Romance, Shoujo, Animal Characteristics, Interspecies Relationship, Japanese Mythology, Master-Servant Relationship, Non-Human Protagonists, Based on a Manga"
Violet Evergarden: Eternity and the Auto Memory Doll,Kyoto Animation,"Drama, Melancholy, Based on a Light Novel"
Mob Psycho 100,Bones,"Action, Comedy, Exorcists, Overpowered Main Characters, Psychic Powers, Psychological, School Life, Supernatural, Superpowers, Based on a Manga, Violence"
Natsume's Book of Friends Season 6 Specials,Shuka,"Drama, Fantasy, Shoujo, Bodyguards, Cats, Countryside, Episodic, Iyashikei, Japanese Mythology, Orphans, Supernatural, Youkai, Based on a Manga"
Kuroko's Basketball 2,Production I.G,"Shounen, Sports, Basketball, School Club, Tournaments, Based on a Manga"
Natsume's Book of Friends Movie: Ephemeral Bond,Shuka,"Drama, Fantasy, Shoujo, Bodyguards, Cats, Countryside, Iyashikei, Japanese Mythology, Orphans, Supernatural, Youkai, Based on a Manga"
Odd Taxi,P.I.C.S.,"Drama, Mystery, Animal Protagonists, Anthropomorphic, Non-Human Protagonists, Psychological, Social Media, Original Work, Violence"
Death Note,MADHOUSE,"Mystery, Shounen, Crime, Criminals, Detectives, Mind Games, Overpowered Main Characters, Psychological, Psychopaths, Rivalries, Secret Identity, Serial Killers, Shinigami, Supernatural, Thriller, Vigilantes, Based on a Manga"
Moriarty the Patriot 2nd Season,Production I.G,"Mystery, Shounen, 19th Century, Detectives, England, Europe, Historical, Sherlock Holmes, Based on a Manga, Violence"
Fate/stay night: Heaven's Feel III. spring song,ufotable,"Action, Fantasy, Romance, Magic, Superpowers, Based on an Eroge, Based on a Visual Novel, Mature Themes,, Suicide,, Violence"
One Piece Movie 14: Stampede,Toei Animation,"Action, Adventure, Shounen, Pirates, Superpowers, Based on a Manga"
Kingdom 3,St. Signpost,"Action, Drama, Seinen, Ancient China, Historical, Political, War, Based on a Manga"
One Piece,Toei Animation,"Action, Adventure, Comedy, Fantasy, Shounen, Pirates, Superpowers, Based on a Manga"
Mushishi: Hihamukage,Artland,"Fantasy, Seinen, Countryside, Illness, Supernatural, Based on a Manga"
Tokyo Revengers,LIDEN FILMS,"Action, Drama, Shounen, Delinquents, Gangs, Time Travel, Based on a Manga, Mature Themes,, Suicide,, Violence"
My Hero Academia Movie 2: Heroes:Rising,Bones,"Action, Sci Fi, Shounen, Superheroes, Superpowers, Based on a Manga"
Fate/Zero 2,ufotable,"Action, Fantasy, Contemporary Fantasy, Magic, Proxy Battles, Rivalries, Superpowers, Urban Fantasy, Based on a Light Novel, Violence"
My Hero Academia,Bones,"Action, Comedy, Drama, Sci Fi, Shounen, School Life, Superheroes, Superpowers, Weak to Strong, Based on a Manga, Violence"
Steins;Gate Movie: Load Region of Deja Vu,WHITE FOX,"Drama, Sci Fi, Thriller, Time Travel, Based on a Visual Novel"
KonoSuba – God’s blessing on this wonderful world! Movie: Legend of Crimson,J.C.Staff,"Comedy, Ecchi, Fantasy, Isekai, NEET, Person in a Strange World, RPG, Based on a Light Novel"
Yuri!!! on Ice,MAPPA,"Drama, Sports, Adult Couples, Ice Skating, Rivalries, Tournaments, Original Work"
Dou Po Cangqiong: San Nian Zhi Yao,Motion Magic,"Action, Fantasy, Chinese Animation, Xianxia, Based on a Web Novel, CG Animation"
Dororo (2019),MAPPA,"Action, Adventure, Shounen, 15th Century, Curse, Dark Fantasy, Deal with the Devil, Demons, Feudal Japan, Historical, Samurai, Supernatural, War, Based on a Manga, Animal Abuse,, Explicit Violence,, Mature Themes,, Physical Abuse,, Sexual Content"
Bunny Drop,Production I.G,"Drama, Josei, Slice of Life, Childcare, Family Life, Iyashikei, Lifestyle Change, noitaminA, Single Parent, Based on a Manga"
Gintama: Shinyaku Benizakura-hen,Sunrise,"Action, Comedy, Drama, Sci Fi, Shounen, Aliens, Feudal Japan, Recap, Samurai, Swordplay, Based on a Manga"
The Garden of Sinners Movie 5: Paradox Paradigm,ufotable,"Drama, Mystery, Overpowered Main Characters, Supernatural, Based on a Light Novel, Explicit Violence,, Mature Themes,, Physical Abuse,, Domestic Abuse"
Bakuman. 3,J.C.Staff,"Drama, Shounen, Anime Industry, Manga Industry, Otaku Culture, Voice Acting, Writers, Based on a Manga"
The Disastrous Life of Saiki K.,J.C.Staff,"Comedy, Shounen, Slice of Life, Breaking the Fourth Wall, Gag, Psychic Powers, School Life, Short Episodes, Supernatural, Superpowers, Based on a Manga"
Given: Uragawa no Sonzai,Lerche,"Music, Based on a Manga"
Black Butler: Book of the Atlantic,A-1 Pictures,"Shounen, 19th Century, Butlers, Demons, Europe, Master-Servant Relationship, Non-Human Protagonists, Supernatural, Zombies, Based on a Manga, Violence"
The Boy and the Beast,Studio Chizu,"Action, Fantasy, Anthropomorphic, Coming of Age, Isekai, Japanese Mythology, Non-Human Protagonists, Person in a Strange World, Original Work"
Miss Kobayashi's Dragon Maid S,Kyoto Animation,"Comedy, Fantasy, Seinen, Slice of Life, Animal Characteristics, Cohabitation, Contemporary Fantasy, Dragons, Maids, Monster Girls, Non-Human Protagonists, Reverse Isekai, Roommates, Urban Fantasy, Based on a Manga"
Kono Oto Tomare! 2nd Season,Platinum Vision,"Drama, Romance, Shounen, Music, School Club, School Life, Based on a Manga"
The Disappearance of Haruhi Suzumiya,Kyoto Animation,"Drama, Sci Fi, Shounen, Psychological, Time Travel, Based on a Light Novel"
Kizumonogatari Part 2: Nekketsu,SHAFT,"Action, Ecchi, Psychological, Supernatural, Vampires, Based on a Light Novel, Explicit Violence"
